{
  "schema_version": 1,
  "work_item_id": "IOS-KNOWLEDGE-INTEGRATIONS-RECOVERY-004",
  "gate": "knowledge-review",
  "work_item_sha256": "459ec006cba25f4cd645dad031e0c9a9ca618eb8e8efa437f9a97de11f4071c7",
  "tree_sha256": "cc083f74a9b690ce5ec3622c2caae8a9a527502b740f35cce5b729c4bf4618ec",
  "reviewer": "control-policy:non-authority-proposal-v1",
  "approved_at": "2026-07-28T04:56:00Z",
  "expires_at": "2026-07-29T04:56:00Z",
  "signature": null
}
